{
  "schema_version": "0.1.0",
  "work_item_id": "WORK-000020",
  "run_id": "RUN-OFS003-PILOT-005",
  "task_id": "OFS-003",
  "monitor_id": "MON-HPCI-CENTERS-001",
  "kind": "source-discovery",
  "required_role": "discovery",
  "status": "completed",
  "idempotency_key": "b8fe2f7b5bebecd186b1a6a40c0834eb351b74d396dc588589f3b1cb0e51608c",
  "payload": {
    "query": "大阪大学 D3センター スーパーコンピュータ 現行システム 更新 調達 電力 設備 公式",
    "query_role": "subject-coverage",
    "candidate_slot": 1,
    "languages": [
      "ja",
      "en"
    ],
    "source_classes": [
      "official-primary",
      "procurement-primary",
      "project-deliverable",
      "center-primary"
    ],
    "source_class_requirements": [
      {
        "requirement_id": "hpci-or-government-primary",
        "one_of": [
          "official-primary",
          "procurement-primary",
          "project-deliverable"
        ],
        "minimum_count": 2
      },
      {
        "requirement_id": "center-primary",
        "one_of": [
          "center-primary"
        ],
        "minimum_count": 10
      }
    ],
    "maximum_unchecked_days": 7,
    "subject_ids": [
      "CENTER-OSAKA-D3"
    ],
    "profile_fields": [
      "current_system",
      "refresh_window",
      "power",
      "facility",
      "migration"
    ],
    "query_template_id": "center-system-refresh-facility"
  },
  "output_paths": [
    "proposals/sources/RUN-OFS003-PILOT-005/WORK-000020.json"
  ],
  "attempt": 1,
  "maximum_attempts": 3,
  "created_at": "2026-08-23T19:34:39.399389Z",
  "updated_at": "2026-08-23T19:37:11.088893Z",
  "output_refs": [
    "proposals/sources/RUN-OFS003-PILOT-005/WORK-000020.json"
  ],
  "output_digests": {
    "proposals/sources/RUN-OFS003-PILOT-005/WORK-000020.json": "c273e0525f7040ee5ca736b906d51307787c3badeaa0da1f89d43d6487cbc6b4"
  },
  "usage": {
    "input_tokens": null,
    "output_tokens": null,
    "cost_usd": null,
    "measurement_note": "Interactive Codex Web research; per-Work-Item usage unavailable."
  },
  "completed_by_agent_id": "discovery-public-01",
  "completion_mode": "leased-local",
  "completed_at": "2026-08-23T19:37:11.088893Z"
}
