{
  "schema_version": "0.1.0",
  "work_item_id": "WORK-000050",
  "run_id": "RUN-OFS003-PILOT-001",
  "task_id": "OFS-003",
  "monitor_id": "MON-HPCI-CENTERS-001",
  "kind": "evidence-extraction",
  "required_role": "extraction",
  "status": "completed",
  "idempotency_key": "7f114c1686ba96b8a1029faf1fdff08afb31920625197e96260699756bbb3dd6",
  "payload": {
    "source_result_ref": "proposals/sources/RUN-OFS003-PILOT-001/WORK-000017.json",
    "parent_work_item_id": "WORK-000017"
  },
  "output_paths": [
    "proposals/evidence/RUN-OFS003-PILOT-001/WORK-000050.json"
  ],
  "attempt": 1,
  "maximum_attempts": 3,
  "created_at": "2026-08-23T18:34:17.238346Z",
  "updated_at": "2026-08-23T18:36:15.772239Z",
  "output_refs": [
    "proposals/evidence/RUN-OFS003-PILOT-001/WORK-000050.json"
  ],
  "output_digests": {
    "proposals/evidence/RUN-OFS003-PILOT-001/WORK-000050.json": "b12722cd1b6299ca0f08849f9943e00983c13187f60a4cc23a6144259de69c2b"
  },
  "usage": {
    "input_tokens": null,
    "output_tokens": null,
    "cost_usd": null,
    "measurement_note": "Interactive pilot; usage unavailable."
  },
  "completed_by_agent_id": "extraction-public-01",
  "completion_mode": "leased-local",
  "completed_at": "2026-08-23T18:36:15.772239Z"
}
