{
  "schema_version": "0.1.0",
  "work_item_id": "WORK-000117",
  "run_id": "RUN-OFS003-PILOT-002",
  "task_id": "OFS-003",
  "monitor_id": "MON-HPCI-CENTERS-001",
  "kind": "validation",
  "required_role": "validator",
  "status": "completed",
  "idempotency_key": "c722f1683a7aa7455827b8a5c6e35c2923621a09b1ed3e0fb0c09148802c67c1",
  "payload": {
    "proposal_ref": "proposals/center-profiles/RUN-OFS003-PILOT-002/CENTER-KYUSHU-RIIT.json",
    "parent_work_item_id": "WORK-000102",
    "review_mode": "blind-first-review",
    "assigned_reviewer_agent_id": "validator-public-01",
    "reviewer_independence_group": "openai-gpt5-codex-interactive"
  },
  "output_paths": [
    "assessments/RUN-OFS003-PILOT-002/PRP-CTR-166347/validator-public-01.json"
  ],
  "attempt": 1,
  "maximum_attempts": 3,
  "created_at": "2026-08-23T19:02:00.254626Z",
  "updated_at": "2026-08-23T19:03:09.614435Z",
  "output_refs": [
    "assessments/RUN-OFS003-PILOT-002/PRP-CTR-166347/validator-public-01.json"
  ],
  "output_digests": {
    "assessments/RUN-OFS003-PILOT-002/PRP-CTR-166347/validator-public-01.json": "dc0a7dae9b8a00f183358da2f7169831f36bada95fb170b06258c9a8b14206d6"
  },
  "usage": {
    "input_tokens": null,
    "output_tokens": null,
    "cost_usd": null,
    "measurement_note": "Same-group pilot review; usage unavailable."
  },
  "completed_by_agent_id": "validator-public-01",
  "completion_mode": "leased-local",
  "completed_at": "2026-08-23T19:03:09.614435Z"
}
