{
  "schema_version": "0.1.0",
  "work_item_id": "WORK-000044",
  "run_id": "RUN-OFS003-PILOT-004",
  "task_id": "OFS-003",
  "monitor_id": "MON-HPCI-CENTERS-001",
  "kind": "source-discovery",
  "required_role": "discovery",
  "status": "completed",
  "idempotency_key": "b905f2719e9b4ea5652150bb9d53519fe81306ae30b90e4e3b68a5d2bdfe3f91",
  "payload": {
    "query": "理化学研究所 計算科学研究センター 更新時期 次期システム 調達 消費電力 電力制約 設備 建屋 冷却 移行計画 互換性 公式 site:www.r-ccs.riken.jp",
    "query_role": "gap-followup",
    "candidate_slot": 1,
    "languages": [
      "ja",
      "en"
    ],
    "source_classes": [
      "center-primary",
      "procurement-primary"
    ],
    "source_class_requirements": [
      {
        "requirement_id": "hpci-or-government-primary",
        "one_of": [
          "official-primary",
          "procurement-primary",
          "project-deliverable"
        ],
        "minimum_count": 2
      },
      {
        "requirement_id": "center-primary",
        "one_of": [
          "center-primary"
        ],
        "minimum_count": 10
      }
    ],
    "maximum_unchecked_days": 7,
    "subject_ids": [
      "CENTER-RIKEN-RCCS"
    ],
    "profile_fields": [
      "refresh_window",
      "power",
      "facility",
      "migration"
    ],
    "query_template_id": "FOLLOWUP-CENTER-RIKEN-RCCS",
    "followup_plan_id": "CFP-AB512E96FE76",
    "followup_query_id": "FOLLOWUP-CENTER-RIKEN-RCCS"
  },
  "output_paths": [
    "proposals/sources/RUN-OFS003-PILOT-004/WORK-000044.json"
  ],
  "attempt": 1,
  "maximum_attempts": 3,
  "created_at": "2026-08-23T19:10:13.082236Z",
  "updated_at": "2026-08-23T19:16:10.288955Z",
  "output_refs": [
    "proposals/sources/RUN-OFS003-PILOT-004/WORK-000044.json"
  ],
  "output_digests": {
    "proposals/sources/RUN-OFS003-PILOT-004/WORK-000044.json": "7d62a42f396a9645fd235e576003e01ab4af7ec4e2f04eabd00bd9cc2993cb11"
  },
  "usage": {
    "input_tokens": null,
    "output_tokens": null,
    "cost_usd": null,
    "measurement_note": "Interactive Codex Web research; per-Work-Item usage unavailable."
  },
  "completed_by_agent_id": "discovery-public-01",
  "completion_mode": "leased-local",
  "completed_at": "2026-08-23T19:16:10.288955Z"
}
