{
  "schema_version": "0.1.0",
  "work_item_id": "WORK-000029",
  "run_id": "RUN-OFS005-PILOT-004",
  "task_id": "OFS-005",
  "monitor_id": "MON-GLOBAL-TECH-001",
  "kind": "synthesis",
  "required_role": "synthesis",
  "status": "completed",
  "idempotency_key": "3b15deb300816e60a61a3def4f20f996b296ef464720146f3375f9acfbd591c9",
  "payload": {
    "query": "site:gov OR site:edu supercomputing exascale post-exascale AI infrastructure roadmap",
    "query_role": "coverage",
    "evidence_bundle_refs": [
      "proposals/evidence/RUN-OFS005-PILOT-004/WORK-000015.json",
      "proposals/evidence/RUN-OFS005-PILOT-004/WORK-000016.json"
    ],
    "parent_work_item_ids": [
      "WORK-000015",
      "WORK-000016"
    ]
  },
  "output_paths": [
    "proposals/claims/RUN-OFS005-PILOT-004/WORK-000029.json"
  ],
  "attempt": 1,
  "maximum_attempts": 3,
  "created_at": "2026-08-23T20:11:16.565288Z",
  "updated_at": "2026-08-23T20:11:16.581156Z",
  "skill": {
    "skill_id": "structured-synthesis",
    "version": "0.1.0",
    "source_ref": "skills/structured-synthesis/SKILL.md",
    "snapshot_ref": "runs/RUN-OFS005-PILOT-004/inputs/skills/structured-synthesis/SKILL.md",
    "digest": "dc204ae6004cbfbc5a40c218ba3b21b9920c645da7dcd5fe4006fef7094a13b8"
  },
  "output_refs": [
    "proposals/claims/RUN-OFS005-PILOT-004/WORK-000029.json"
  ],
  "output_digests": {
    "proposals/claims/RUN-OFS005-PILOT-004/WORK-000029.json": "101d377270bbacff1a83a26961d72aa260003ab0e037323dda5f524501d0d4ec"
  },
  "usage": {
    "input_tokens": null,
    "output_tokens": null,
    "cost_usd": null,
    "measurement_note": "Interactive synthesis; provider cost and token counts unavailable."
  },
  "completed_by_agent_id": "synthesis-public-01",
  "completion_mode": "leased-local",
  "completed_at": "2026-08-23T20:11:16.581156Z"
}
