{
  "schema_version": "0.1.0",
  "work_item_id": "WORK-000018",
  "run_id": "RUN-OFS005-PILOT-004",
  "task_id": "OFS-005",
  "monitor_id": "MON-GLOBAL-TECH-001",
  "kind": "evidence-extraction",
  "required_role": "extraction",
  "status": "completed",
  "idempotency_key": "2b97fe59f8b69ed039e2126d3840732b152217e9c3f1b087a66fdb1d9fa1c810",
  "payload": {
    "source_result_ref": "proposals/sources/RUN-OFS005-PILOT-004/WORK-000006.json",
    "parent_work_item_id": "WORK-000006"
  },
  "output_paths": [
    "proposals/evidence/RUN-OFS005-PILOT-004/WORK-000018.json"
  ],
  "attempt": 1,
  "maximum_attempts": 3,
  "created_at": "2026-08-23T20:11:16.533843Z",
  "updated_at": "2026-08-23T20:11:16.551457Z",
  "skill": {
    "skill_id": "evidence-extraction",
    "version": "0.1.0",
    "source_ref": "skills/evidence-extraction/SKILL.md",
    "snapshot_ref": "runs/RUN-OFS005-PILOT-004/inputs/skills/evidence-extraction/SKILL.md",
    "digest": "108bcd240932ddb4e038138246afe9abc7e8fedd63ddbaaa737b4714803976ec"
  },
  "output_refs": [
    "proposals/evidence/RUN-OFS005-PILOT-004/WORK-000018.json"
  ],
  "output_digests": {
    "proposals/evidence/RUN-OFS005-PILOT-004/WORK-000018.json": "7f058ac70d9640cd01863c28a12a62847f6c0d79509104bf90204af8e906ec4a"
  },
  "usage": {
    "input_tokens": null,
    "output_tokens": null,
    "cost_usd": null,
    "measurement_note": "Local deterministic extraction from reviewed candidate passage."
  },
  "completed_by_agent_id": "extraction-public-01",
  "completion_mode": "leased-local",
  "completed_at": "2026-08-23T20:11:16.551457Z"
}
