{
  "schema_version": "0.1.0",
  "work_item_id": "WORK-000101",
  "run_id": "RUN-OFS003-PILOT-004",
  "task_id": "OFS-003",
  "monitor_id": "MON-HPCI-CENTERS-001",
  "kind": "center-profile-synthesis",
  "required_role": "synthesis",
  "status": "completed",
  "idempotency_key": "f57566059faa08cd0ccd5355f31a26f63a797f850bc39ff61dfb3716334606ea",
  "payload": {
    "center_id": "CENTER-JCAHPC",
    "profile_fields": [
      "current_system",
      "data_connectivity",
      "facility",
      "migration",
      "operations",
      "power",
      "priority_domains",
      "refresh_window",
      "software",
      "users"
    ],
    "evidence_bundle_refs": [
      "proposals/evidence/RUN-OFS003-PILOT-004/WORK-000074.json",
      "proposals/evidence/RUN-OFS003-PILOT-004/WORK-000075.json",
      "proposals/evidence/RUN-OFS003-PILOT-004/WORK-000086.json"
    ],
    "parent_work_item_ids": [
      "WORK-000074",
      "WORK-000075",
      "WORK-000086"
    ]
  },
  "output_paths": [
    "proposals/center-profiles/RUN-OFS003-PILOT-004/CENTER-JCAHPC.json"
  ],
  "attempt": 1,
  "maximum_attempts": 3,
  "created_at": "2026-08-23T19:16:40.419327Z",
  "updated_at": "2026-08-23T19:16:44.787149Z",
  "output_refs": [
    "proposals/center-profiles/RUN-OFS003-PILOT-004/CENTER-JCAHPC.json"
  ],
  "output_digests": {
    "proposals/center-profiles/RUN-OFS003-PILOT-004/CENTER-JCAHPC.json": "bc855646587e029e689e6b7cd47d2ab4c65e49ff9ca38d5e87d2cd38906b7658"
  },
  "usage": {
    "input_tokens": null,
    "output_tokens": null,
    "cost_usd": null,
    "measurement_note": "Interactive pilot; usage unavailable."
  },
  "completed_by_agent_id": "synthesis-public-01",
  "completion_mode": "leased-local",
  "completed_at": "2026-08-23T19:16:44.787149Z"
}
