{
  "schema_version": "0.1.0",
  "work_item_id": "WORK-000030",
  "run_id": "RUN-OFS001-PILOT-002",
  "task_id": "OFS-001",
  "monitor_id": "MON-MEMORY-001",
  "kind": "synthesis",
  "required_role": "synthesis",
  "status": "completed",
  "idempotency_key": "f01acad5490320e15fc4e6217d980078227ba49c822df6dbcaf0f648e0013dbc",
  "payload": {
    "query": "emerging memory HPC",
    "query_role": "coverage",
    "evidence_bundle_refs": [
      "proposals/evidence/RUN-OFS001-PILOT-002/WORK-000019.json",
      "proposals/evidence/RUN-OFS001-PILOT-002/WORK-000020.json"
    ],
    "parent_work_item_ids": [
      "WORK-000019",
      "WORK-000020"
    ]
  },
  "output_paths": [
    "proposals/claims/RUN-OFS001-PILOT-002/WORK-000030.json"
  ],
  "attempt": 1,
  "maximum_attempts": 3,
  "created_at": "2026-08-23T17:11:38.141805Z",
  "updated_at": "2026-08-23T17:12:57.179672Z",
  "output_refs": [
    "proposals/claims/RUN-OFS001-PILOT-002/WORK-000030.json"
  ],
  "output_digests": {
    "proposals/claims/RUN-OFS001-PILOT-002/WORK-000030.json": "0fcdea2bae3aa8f63a3f4efab3539723356752d87aad741b2ab3ad7cc584ccf4"
  },
  "completed_by_agent_id": "synthesis-public-01",
  "completed_at": "2026-08-23T17:12:57.179672Z"
}
