{
  "schema_version": "0.1.0",
  "work_item_id": "WORK-000001",
  "run_id": "RUN-OFS001-PILOT-003",
  "task_id": "OFS-001",
  "monitor_id": "MON-MEMORY-001",
  "kind": "source-discovery",
  "required_role": "discovery",
  "status": "completed",
  "idempotency_key": "596651f90702569a75b845b47b8a438c911472f4bf2c040def5bb564244ffaf1",
  "payload": {
    "query": "HPC memory hierarchy roadmap",
    "query_role": "coverage",
    "candidate_slot": 1,
    "languages": [
      "ja",
      "en"
    ],
    "source_classes": [
      "official-primary",
      "standards-body",
      "vendor-primary",
      "research-primary",
      "peer-reviewed-research",
      "preprint-research",
      "independent-analysis"
    ],
    "source_class_requirements": [
      {
        "requirement_id": "authoritative-primary",
        "one_of": [
          "official-primary",
          "standards-body",
          "vendor-primary",
          "research-primary"
        ],
        "minimum_count": 2
      },
      {
        "requirement_id": "independent-technical",
        "one_of": [
          "peer-reviewed-research",
          "independent-analysis"
        ],
        "minimum_count": 2
      },
      {
        "requirement_id": "independent-analysis",
        "one_of": [
          "independent-analysis"
        ],
        "minimum_count": 1
      }
    ],
    "maximum_unchecked_days": 14
  },
  "output_paths": [
    "proposals/sources/RUN-OFS001-PILOT-003/WORK-000001.json"
  ],
  "attempt": 1,
  "maximum_attempts": 3,
  "created_at": "2026-08-23T17:35:38.186586Z",
  "updated_at": "2026-08-23T17:42:40.327485Z",
  "output_refs": [
    "proposals/sources/RUN-OFS001-PILOT-003/WORK-000001.json"
  ],
  "output_digests": {
    "proposals/sources/RUN-OFS001-PILOT-003/WORK-000001.json": "505b627571eabe34c6031d5071d7fed7aca03076da533fe20c22c24061955bb9"
  },
  "completed_by_agent_id": "discovery-public-01",
  "completed_at": "2026-08-23T17:42:40.327485Z"
}
