{
  "schema_version": "0.1.0",
  "work_item_id": "WORK-000077",
  "run_id": "RUN-OFS003-PILOT-001",
  "task_id": "OFS-003",
  "monitor_id": "MON-HPCI-CENTERS-001",
  "kind": "center-profile-synthesis",
  "required_role": "synthesis",
  "status": "completed",
  "idempotency_key": "160633b1dd93f6700599eb8091f30be4051f5167eee43e84ee0f9c8b08b7c07e",
  "payload": {
    "center_id": "CENTER-RIKEN-RCCS",
    "profile_fields": [
      "current_system",
      "data_connectivity",
      "facility",
      "migration",
      "operations",
      "power",
      "priority_domains",
      "refresh_window",
      "software",
      "users"
    ],
    "evidence_bundle_refs": [
      "proposals/evidence/RUN-OFS003-PILOT-001/WORK-000037.json",
      "proposals/evidence/RUN-OFS003-PILOT-001/WORK-000038.json"
    ],
    "parent_work_item_ids": [
      "WORK-000037",
      "WORK-000038"
    ]
  },
  "output_paths": [
    "proposals/center-profiles/RUN-OFS003-PILOT-001/CENTER-RIKEN-RCCS.json"
  ],
  "attempt": 1,
  "maximum_attempts": 3,
  "created_at": "2026-08-23T18:36:15.880811Z",
  "updated_at": "2026-08-23T18:37:51.743990Z",
  "output_refs": [
    "proposals/center-profiles/RUN-OFS003-PILOT-001/CENTER-RIKEN-RCCS.json"
  ],
  "output_digests": {
    "proposals/center-profiles/RUN-OFS003-PILOT-001/CENTER-RIKEN-RCCS.json": "cc50d55d62e21a03f2107460494e8ab8a1a547c01681044d1651640b1209b79a"
  },
  "usage": {
    "input_tokens": null,
    "output_tokens": null,
    "cost_usd": null,
    "measurement_note": "Interactive pilot; usage unavailable."
  },
  "completed_by_agent_id": "synthesis-public-01",
  "completion_mode": "leased-local",
  "completed_at": "2026-08-23T18:37:51.743990Z"
}
