{
  "schema_version": "0.1.0",
  "work_item_id": "WORK-000030",
  "run_id": "RUN-OFS003-PILOT-003",
  "task_id": "OFS-003",
  "monitor_id": "MON-HPCI-CENTERS-001",
  "kind": "source-discovery",
  "required_role": "discovery",
  "status": "cancelled",
  "idempotency_key": "c5a15211339ea67dd8fbd32ed18b7c41cc2801095588db3bae40ad5e6bb8b8dc",
  "payload": {
    "query": "理化学研究所 情報統合本部 スーパーコンピュータ 現行システム 更新 調達 電力 設備 公式",
    "query_role": "subject-coverage",
    "candidate_slot": 1,
    "languages": [
      "ja",
      "en"
    ],
    "source_classes": [
      "official-primary",
      "procurement-primary",
      "project-deliverable",
      "center-primary"
    ],
    "source_class_requirements": [
      {
        "requirement_id": "hpci-or-government-primary",
        "one_of": [
          "official-primary",
          "procurement-primary",
          "project-deliverable"
        ],
        "minimum_count": 2
      },
      {
        "requirement_id": "center-primary",
        "one_of": [
          "center-primary"
        ],
        "minimum_count": 10
      }
    ],
    "maximum_unchecked_days": 7,
    "subject_ids": [
      "CENTER-RIKEN-IRDS"
    ],
    "profile_fields": [
      "current_system",
      "refresh_window",
      "power",
      "facility",
      "migration"
    ],
    "query_template_id": "center-system-refresh-facility"
  },
  "output_paths": [
    "proposals/sources/RUN-OFS003-PILOT-003/WORK-000030.json"
  ],
  "attempt": 0,
  "maximum_attempts": 3,
  "created_at": "2026-08-23T19:07:44.295606Z",
  "updated_at": "2026-08-23T19:10:13.017110Z",
  "cancellation": {
    "reason": "Incorrect future-dated follow-up plan was selected before recency fix",
    "actor": "Codex-maintainer",
    "recorded_at": "2026-08-23T19:10:13.017110Z"
  }
}
