{
  "schema_version": "0.1.0",
  "work_item_id": "WORK-000005",
  "run_id": "RUN-OFS005-PILOT-009",
  "task_id": "OFS-005",
  "monitor_id": "MON-GLOBAL-TECH-001",
  "kind": "source-discovery",
  "required_role": "discovery",
  "status": "completed",
  "idempotency_key": "a4d82a4593c2de9b0a479882dfd0b9ccd7dd10bbbfdfcd8858f4d43e6e4165a6",
  "payload": {
    "query": "HPC AI for Science startup emerging technology prototype benchmark deployment discontinued",
    "query_role": "coverage",
    "candidate_slot": 1,
    "languages": [
      "en",
      "ja",
      "source-language"
    ],
    "source_classes": [
      "official-primary",
      "research-primary",
      "standards-body",
      "peer-reviewed-research",
      "vendor-primary",
      "procurement-primary"
    ],
    "source_class_requirements": [],
    "maximum_unchecked_days": 7
  },
  "output_paths": [
    "proposals/sources/RUN-OFS005-PILOT-009/WORK-000005.json"
  ],
  "attempt": 1,
  "maximum_attempts": 3,
  "created_at": "2026-08-23T20:33:53.821889Z",
  "updated_at": "2026-08-23T20:33:59.227687Z",
  "skill": {
    "skill_id": "worldwide-technology-survey",
    "version": "0.1.0",
    "source_ref": "skills/worldwide-technology-survey/SKILL.md",
    "snapshot_ref": "runs/RUN-OFS005-PILOT-009/inputs/skills/worldwide-technology-survey/SKILL.md",
    "digest": "e6509444fef312d0308e788fefdf31be2e1d421c69a737dc6cb2644e34387425"
  },
  "output_refs": [
    "proposals/sources/RUN-OFS005-PILOT-009/WORK-000005.json"
  ],
  "output_digests": {
    "proposals/sources/RUN-OFS005-PILOT-009/WORK-000005.json": "89d00b55f7617fdb0f28745b3dec476bbdc2c44ee26cc1b9dc5cbd7cb5178e27"
  },
  "usage": {
    "input_tokens": null,
    "output_tokens": null,
    "cost_usd": null,
    "measurement_note": "Interactive public-Web Pilot; provider cost and token counts unavailable."
  },
  "completed_by_agent_id": "discovery-public-01",
  "completion_mode": "leased-local",
  "completed_at": "2026-08-23T20:33:59.227687Z"
}
