{
  "schema_version": "0.1.0",
  "work_item_id": "WORK-000032",
  "run_id": "RUN-OFS005-PILOT-004",
  "task_id": "OFS-005",
  "monitor_id": "MON-GLOBAL-TECH-001",
  "kind": "validation",
  "required_role": "validator",
  "status": "completed",
  "idempotency_key": "0e5e7cb20ebd4aae12ae3e895a1d63a253c05c756dfed243068241cd1c23103e",
  "payload": {
    "proposal_ref": "proposals/claims/RUN-OFS005-PILOT-004/WORK-000026.json",
    "parent_work_item_id": "WORK-000026",
    "review_mode": "blind-first-review",
    "assigned_reviewer_agent_id": "validator-public-01",
    "reviewer_independence_group": "openai-gpt5-codex-interactive"
  },
  "output_paths": [
    "assessments/RUN-OFS005-PILOT-004/PRP-CLM-218203/validator-public-01.json"
  ],
  "attempt": 1,
  "maximum_attempts": 3,
  "created_at": "2026-08-23T20:11:16.585841Z",
  "updated_at": "2026-08-23T20:11:16.595878Z",
  "skill": {
    "skill_id": "source-validation",
    "version": "0.1.0",
    "source_ref": "skills/source-validation/SKILL.md",
    "snapshot_ref": "runs/RUN-OFS005-PILOT-004/inputs/skills/source-validation/SKILL.md",
    "digest": "bda587b2dad51f822d035de5ebf57ed0f33618ad42db4b7688d20cdb6e68c71a"
  },
  "output_refs": [
    "assessments/RUN-OFS005-PILOT-004/PRP-CLM-218203/validator-public-01.json"
  ],
  "output_digests": {
    "assessments/RUN-OFS005-PILOT-004/PRP-CLM-218203/validator-public-01.json": "1a2181cf8616aa03192d38e728a53ae5cacc0e081ffd53212c9836adc4f2f677"
  },
  "usage": {
    "input_tokens": null,
    "output_tokens": null,
    "cost_usd": null,
    "measurement_note": "Correlated-model Pilot review; not an independent Consensus vote."
  },
  "completed_by_agent_id": "validator-public-01",
  "completion_mode": "leased-local",
  "completed_at": "2026-08-23T20:11:16.595878Z"
}
