{
  "schema_version": "0.1.0",
  "work_item_id": "WORK-000104",
  "run_id": "RUN-OFS003-PILOT-004",
  "task_id": "OFS-003",
  "monitor_id": "MON-HPCI-CENTERS-001",
  "kind": "center-profile-synthesis",
  "required_role": "synthesis",
  "status": "completed",
  "idempotency_key": "a752dcee46a46c25c64638fd6387e353722fe6b78b73f069f6f8a322189855e0",
  "payload": {
    "center_id": "CENTER-NAGOYA-ITC",
    "profile_fields": [
      "current_system",
      "data_connectivity",
      "facility",
      "migration",
      "operations",
      "power",
      "priority_domains",
      "refresh_window",
      "software",
      "users"
    ],
    "evidence_bundle_refs": [
      "proposals/evidence/RUN-OFS003-PILOT-004/WORK-000064.json",
      "proposals/evidence/RUN-OFS003-PILOT-004/WORK-000065.json",
      "proposals/evidence/RUN-OFS003-PILOT-004/WORK-000089.json"
    ],
    "parent_work_item_ids": [
      "WORK-000064",
      "WORK-000065",
      "WORK-000089"
    ]
  },
  "output_paths": [
    "proposals/center-profiles/RUN-OFS003-PILOT-004/CENTER-NAGOYA-ITC.json"
  ],
  "attempt": 1,
  "maximum_attempts": 3,
  "created_at": "2026-08-23T19:16:40.419327Z",
  "updated_at": "2026-08-23T19:16:44.803456Z",
  "output_refs": [
    "proposals/center-profiles/RUN-OFS003-PILOT-004/CENTER-NAGOYA-ITC.json"
  ],
  "output_digests": {
    "proposals/center-profiles/RUN-OFS003-PILOT-004/CENTER-NAGOYA-ITC.json": "abe0bcbc9f31099af980e7d6f246e9a1c5b91bafb8743e1be32da4757f13b4cf"
  },
  "usage": {
    "input_tokens": null,
    "output_tokens": null,
    "cost_usd": null,
    "measurement_note": "Interactive pilot; usage unavailable."
  },
  "completed_by_agent_id": "synthesis-public-01",
  "completion_mode": "leased-local",
  "completed_at": "2026-08-23T19:16:44.803456Z"
}
