{
  "schema_version": "0.1.0",
  "work_item_id": "WORK-000003",
  "run_id": "RUN-OFS003-PILOT-003",
  "task_id": "OFS-003",
  "monitor_id": "MON-HPCI-CENTERS-001",
  "kind": "source-discovery",
  "required_role": "discovery",
  "status": "cancelled",
  "idempotency_key": "332a03ce09c0aa5dfa67f83015dc36884a28352e5d40bfc8ebc886ef65e60820",
  "payload": {
    "query": "site:mext.go.jp HPCI 計算資源 整備 運用 計画",
    "query_role": "coverage",
    "candidate_slot": 1,
    "languages": [
      "ja",
      "en"
    ],
    "source_classes": [
      "official-primary",
      "procurement-primary",
      "project-deliverable",
      "center-primary"
    ],
    "source_class_requirements": [
      {
        "requirement_id": "hpci-or-government-primary",
        "one_of": [
          "official-primary",
          "procurement-primary",
          "project-deliverable"
        ],
        "minimum_count": 2
      },
      {
        "requirement_id": "center-primary",
        "one_of": [
          "center-primary"
        ],
        "minimum_count": 10
      }
    ],
    "maximum_unchecked_days": 7
  },
  "output_paths": [
    "proposals/sources/RUN-OFS003-PILOT-003/WORK-000003.json"
  ],
  "attempt": 0,
  "maximum_attempts": 3,
  "created_at": "2026-08-23T19:07:44.295606Z",
  "updated_at": "2026-08-23T19:10:13.017110Z",
  "cancellation": {
    "reason": "Incorrect future-dated follow-up plan was selected before recency fix",
    "actor": "Codex-maintainer",
    "recorded_at": "2026-08-23T19:10:13.017110Z"
  }
}
