{
  "schema_version": "0.1.0",
  "work_item_id": "WORK-000040",
  "run_id": "RUN-OFS003-PILOT-003",
  "task_id": "OFS-003",
  "monitor_id": "MON-HPCI-CENTERS-001",
  "kind": "source-discovery",
  "required_role": "discovery",
  "status": "cancelled",
  "idempotency_key": "f795c66e812fbf66bc6162a5882bd58c669044930df928cf17c23b41b6d13a2c",
  "payload": {
    "query": "九州大学 情報基盤研究開発センター 更新時期 次期システム 調達 消費電力 電力制約 設備 建屋 冷却 移行計画 互換性 公式 site:ri2t.kyushu-u.ac.jp",
    "query_role": "gap-followup",
    "candidate_slot": 1,
    "languages": [
      "ja",
      "en"
    ],
    "source_classes": [
      "center-primary",
      "procurement-primary"
    ],
    "source_class_requirements": [
      {
        "requirement_id": "hpci-or-government-primary",
        "one_of": [
          "official-primary",
          "procurement-primary",
          "project-deliverable"
        ],
        "minimum_count": 2
      },
      {
        "requirement_id": "center-primary",
        "one_of": [
          "center-primary"
        ],
        "minimum_count": 10
      }
    ],
    "maximum_unchecked_days": 7,
    "subject_ids": [
      "CENTER-KYUSHU-RIIT"
    ],
    "profile_fields": [
      "refresh_window",
      "power",
      "facility",
      "migration"
    ],
    "query_template_id": "FOLLOWUP-CENTER-KYUSHU-RIIT",
    "followup_plan_id": "CFP-5C1CC1491AFC",
    "followup_query_id": "FOLLOWUP-CENTER-KYUSHU-RIIT"
  },
  "output_paths": [
    "proposals/sources/RUN-OFS003-PILOT-003/WORK-000040.json"
  ],
  "attempt": 0,
  "maximum_attempts": 3,
  "created_at": "2026-08-23T19:07:44.295606Z",
  "updated_at": "2026-08-23T19:10:13.017110Z",
  "cancellation": {
    "reason": "Incorrect future-dated follow-up plan was selected before recency fix",
    "actor": "Codex-maintainer",
    "recorded_at": "2026-08-23T19:10:13.017110Z"
  }
}
