{
  "schema_version": "0.1.0",
  "work_item_id": "WORK-000105",
  "run_id": "RUN-OFS003-PILOT-005",
  "task_id": "OFS-003",
  "monitor_id": "MON-HPCI-CENTERS-001",
  "kind": "center-profile-synthesis",
  "required_role": "synthesis",
  "status": "completed",
  "idempotency_key": "7ed64c4f7681ebe558910b2fcf12cbb7e0b11c96b320d609b3fba2c4ba137573",
  "payload": {
    "center_id": "CENTER-OSAKA-D3",
    "profile_fields": [
      "current_system",
      "data_connectivity",
      "facility",
      "migration",
      "operations",
      "power",
      "priority_domains",
      "refresh_window",
      "software",
      "users"
    ],
    "evidence_bundle_refs": [
      "proposals/evidence/RUN-OFS003-PILOT-004/WORK-000090.json",
      "proposals/evidence/RUN-OFS003-PILOT-005/WORK-000068.json",
      "proposals/evidence/RUN-OFS003-PILOT-005/WORK-000069.json",
      "proposals/evidence/RUN-OFS003-PILOT-005/WORK-000090.json"
    ],
    "parent_work_item_ids": [
      "WORK-000068",
      "WORK-000069",
      "WORK-000090"
    ],
    "predecessor_run_id": "RUN-OFS003-PILOT-004",
    "predecessor_profile_ref": "proposals/center-profiles/RUN-OFS003-PILOT-004/CENTER-OSAKA-D3.json",
    "predecessor_profile_digest": "a64b93474011bf46bc48e4bb2f1b3a60bf28ca452d49e2a4320f77077d650d3c",
    "predecessor_evidence_bundle_refs": [
      "proposals/evidence/RUN-OFS003-PILOT-004/WORK-000090.json"
    ]
  },
  "output_paths": [
    "proposals/center-profiles/RUN-OFS003-PILOT-005/CENTER-OSAKA-D3.json"
  ],
  "attempt": 1,
  "maximum_attempts": 3,
  "created_at": "2026-08-23T19:37:46.659497Z",
  "updated_at": "2026-08-23T19:38:56.038243Z",
  "output_refs": [
    "proposals/center-profiles/RUN-OFS003-PILOT-005/CENTER-OSAKA-D3.json"
  ],
  "output_digests": {
    "proposals/center-profiles/RUN-OFS003-PILOT-005/CENTER-OSAKA-D3.json": "6de07d52710fbac072ab39d7b88aa8dbab84373a2ce89e12092d1700c31a9c74"
  },
  "usage": {
    "input_tokens": null,
    "output_tokens": null,
    "cost_usd": null,
    "measurement_note": "Interactive pilot; usage unavailable."
  },
  "completed_by_agent_id": "synthesis-public-01",
  "completion_mode": "leased-local",
  "completed_at": "2026-08-23T19:38:56.038243Z"
}
