{
  "schema_version": "0.1.0",
  "work_item_id": "WORK-000033",
  "run_id": "RUN-OFS001-PILOT-003",
  "task_id": "OFS-001",
  "monitor_id": "MON-MEMORY-001",
  "kind": "validation",
  "required_role": "validator",
  "status": "completed",
  "idempotency_key": "573aa44d8a956fb0ca5e3f968695fa6cef1efa24ca9a1bd9cb8053033674889e",
  "payload": {
    "proposal_ref": "proposals/claims/RUN-OFS001-PILOT-003/WORK-000027.json",
    "parent_work_item_id": "WORK-000027",
    "review_mode": "blind-first-review"
  },
  "output_paths": [
    "assessments/RUN-OFS001-PILOT-003/WORK-000033.json"
  ],
  "attempt": 1,
  "maximum_attempts": 3,
  "created_at": "2026-08-23T17:45:50.213590Z",
  "updated_at": "2026-08-23T17:47:27.369493Z",
  "output_refs": [
    "assessments/RUN-OFS001-PILOT-003/WORK-000033.json"
  ],
  "output_digests": {
    "assessments/RUN-OFS001-PILOT-003/WORK-000033.json": "ec41a7d7007557feb097a2081c1e605d2664364c9681639fb26ccb168d7b637a"
  },
  "completed_by_agent_id": "validator-public-01",
  "completed_at": "2026-08-23T17:47:27.369493Z"
}
