{
  "schema_version": "0.1.0",
  "work_item_id": "WORK-000048",
  "run_id": "RUN-OFS003-PILOT-002",
  "task_id": "OFS-003",
  "monitor_id": "MON-HPCI-CENTERS-001",
  "kind": "source-discovery",
  "required_role": "discovery",
  "status": "completed",
  "idempotency_key": "8cd0a26854442cc16e932e9b686d23a5fbf34ac2311f70ca7b4485551feebcc1",
  "payload": {
    "query": "東京大学 情報基盤センター 更新時期 次期システム 調達 消費電力 電力制約 設備 建屋 冷却 移行計画 互換性 公式 site:www.itc.u-tokyo.ac.jp",
    "query_role": "gap-followup",
    "candidate_slot": 1,
    "languages": [
      "ja",
      "en"
    ],
    "source_classes": [
      "center-primary",
      "procurement-primary"
    ],
    "source_class_requirements": [
      {
        "requirement_id": "hpci-or-government-primary",
        "one_of": [
          "official-primary",
          "procurement-primary",
          "project-deliverable"
        ],
        "minimum_count": 2
      },
      {
        "requirement_id": "center-primary",
        "one_of": [
          "center-primary"
        ],
        "minimum_count": 10
      }
    ],
    "maximum_unchecked_days": 7,
    "subject_ids": [
      "CENTER-UTOKYO-ITC"
    ],
    "profile_fields": [
      "refresh_window",
      "power",
      "facility",
      "migration"
    ],
    "query_template_id": "FOLLOWUP-CENTER-UTOKYO-ITC",
    "followup_plan_id": "CFP-5C1CC1491AFC",
    "followup_query_id": "FOLLOWUP-CENTER-UTOKYO-ITC"
  },
  "output_paths": [
    "proposals/sources/RUN-OFS003-PILOT-002/WORK-000048.json"
  ],
  "attempt": 1,
  "maximum_attempts": 3,
  "created_at": "2026-08-23T18:50:30.945219Z",
  "updated_at": "2026-08-23T18:58:14.050397Z",
  "output_refs": [
    "proposals/sources/RUN-OFS003-PILOT-002/WORK-000048.json"
  ],
  "output_digests": {
    "proposals/sources/RUN-OFS003-PILOT-002/WORK-000048.json": "cd0eaeaa0071985ace7a16cd109e8bbc8ded07dfff1d0d683f8c1916eb9c6c9b"
  },
  "usage": {
    "input_tokens": null,
    "output_tokens": null,
    "cost_usd": null,
    "measurement_note": "Interactive Codex Web research; per-Work-Item usage unavailable."
  },
  "completed_by_agent_id": "discovery-public-01",
  "completion_mode": "leased-local",
  "completed_at": "2026-08-23T18:58:14.050397Z"
}
