{
  "schema_version": "0.1.0",
  "work_item_id": "WORK-000013",
  "run_id": "RUN-OFS003-PILOT-001",
  "task_id": "OFS-003",
  "monitor_id": "MON-HPCI-CENTERS-001",
  "kind": "source-discovery",
  "required_role": "discovery",
  "status": "completed",
  "idempotency_key": "a2581f8ef8b48370c06e2e5a387dca69c2fe0aae5d795fd9342c6baf9885a89c",
  "payload": {
    "query": "東京大学 情報基盤センター 利用分野 ソフトウェア 運用 ストレージ ネットワーク 公式",
    "query_role": "subject-coverage",
    "candidate_slot": 1,
    "languages": [
      "ja",
      "en"
    ],
    "source_classes": [
      "official-primary",
      "procurement-primary",
      "project-deliverable",
      "center-primary"
    ],
    "source_class_requirements": [
      {
        "requirement_id": "hpci-or-government-primary",
        "one_of": [
          "official-primary",
          "procurement-primary",
          "project-deliverable"
        ],
        "minimum_count": 2
      },
      {
        "requirement_id": "center-primary",
        "one_of": [
          "center-primary"
        ],
        "minimum_count": 10
      }
    ],
    "maximum_unchecked_days": 7,
    "subject_ids": [
      "CENTER-UTOKYO-ITC"
    ],
    "profile_fields": [
      "users",
      "priority_domains",
      "software",
      "operations",
      "data_connectivity"
    ],
    "query_template_id": "center-users-software-operations"
  },
  "output_paths": [
    "proposals/sources/RUN-OFS003-PILOT-001/WORK-000013.json"
  ],
  "attempt": 1,
  "maximum_attempts": 3,
  "created_at": "2026-08-23T18:29:26.396639Z",
  "updated_at": "2026-08-23T18:33:37.387128Z",
  "output_refs": [
    "proposals/sources/RUN-OFS003-PILOT-001/WORK-000013.json"
  ],
  "output_digests": {
    "proposals/sources/RUN-OFS003-PILOT-001/WORK-000013.json": "f2f204e0974d058bc383271541cfe619ce1949bb4da5442d166ca13979bf00c7"
  },
  "usage": {
    "input_tokens": null,
    "output_tokens": null,
    "cost_usd": null,
    "measurement_note": "Interactive Codex Web research; per-Work-Item usage unavailable."
  },
  "completed_by_agent_id": "discovery-public-01",
  "completion_mode": "leased-local",
  "completed_at": "2026-08-23T18:33:37.387128Z"
}
