{
  "schema_version": "0.1.0",
  "work_item_id": "WORK-000042",
  "run_id": "RUN-OFS003-PILOT-004",
  "task_id": "OFS-003",
  "monitor_id": "MON-HPCI-CENTERS-001",
  "kind": "source-discovery",
  "required_role": "discovery",
  "status": "completed",
  "idempotency_key": "bf5c68c2f01afbfe36f9340958d2dc195a762bf09c123f3cbee06320ebde7e8b",
  "payload": {
    "query": "大阪大学 D3センター 消費電力 電力制約 設備 建屋 冷却 移行計画 互換性 ストレージ ネットワーク データ転送 公式 site:www.d3c.osaka-u.ac.jp",
    "query_role": "gap-followup",
    "candidate_slot": 1,
    "languages": [
      "ja",
      "en"
    ],
    "source_classes": [
      "center-primary",
      "procurement-primary"
    ],
    "source_class_requirements": [
      {
        "requirement_id": "hpci-or-government-primary",
        "one_of": [
          "official-primary",
          "procurement-primary",
          "project-deliverable"
        ],
        "minimum_count": 2
      },
      {
        "requirement_id": "center-primary",
        "one_of": [
          "center-primary"
        ],
        "minimum_count": 10
      }
    ],
    "maximum_unchecked_days": 7,
    "subject_ids": [
      "CENTER-OSAKA-D3"
    ],
    "profile_fields": [
      "power",
      "facility",
      "migration",
      "data_connectivity"
    ],
    "query_template_id": "FOLLOWUP-CENTER-OSAKA-D3",
    "followup_plan_id": "CFP-AB512E96FE76",
    "followup_query_id": "FOLLOWUP-CENTER-OSAKA-D3"
  },
  "output_paths": [
    "proposals/sources/RUN-OFS003-PILOT-004/WORK-000042.json"
  ],
  "attempt": 1,
  "maximum_attempts": 3,
  "created_at": "2026-08-23T19:10:13.082236Z",
  "updated_at": "2026-08-23T19:16:10.283840Z",
  "output_refs": [
    "proposals/sources/RUN-OFS003-PILOT-004/WORK-000042.json"
  ],
  "output_digests": {
    "proposals/sources/RUN-OFS003-PILOT-004/WORK-000042.json": "82ec41ac58a0be420fbb7d1aa1f12c67551adb65a365ebc7666ef83997827d16"
  },
  "usage": {
    "input_tokens": null,
    "output_tokens": null,
    "cost_usd": null,
    "measurement_note": "Interactive Codex Web research; per-Work-Item usage unavailable."
  },
  "completed_by_agent_id": "discovery-public-01",
  "completion_mode": "leased-local",
  "completed_at": "2026-08-23T19:16:10.283840Z"
}
