{
  "schema_version": "0.1.0",
  "work_item_id": "WORK-000003",
  "run_id": "RUN-OFS003-PILOT-004",
  "task_id": "OFS-003",
  "monitor_id": "MON-HPCI-CENTERS-001",
  "kind": "source-discovery",
  "required_role": "discovery",
  "status": "completed",
  "idempotency_key": "5ece0319eacd1d96b0ff6389a193dcedcab6ff1cdfd2c736fd6d5d9b8ab2fcfb",
  "payload": {
    "query": "site:mext.go.jp HPCI 計算資源 整備 運用 計画",
    "query_role": "coverage",
    "candidate_slot": 1,
    "languages": [
      "ja",
      "en"
    ],
    "source_classes": [
      "official-primary",
      "procurement-primary",
      "project-deliverable",
      "center-primary"
    ],
    "source_class_requirements": [
      {
        "requirement_id": "hpci-or-government-primary",
        "one_of": [
          "official-primary",
          "procurement-primary",
          "project-deliverable"
        ],
        "minimum_count": 2
      },
      {
        "requirement_id": "center-primary",
        "one_of": [
          "center-primary"
        ],
        "minimum_count": 10
      }
    ],
    "maximum_unchecked_days": 7
  },
  "output_paths": [
    "proposals/sources/RUN-OFS003-PILOT-004/WORK-000003.json"
  ],
  "attempt": 1,
  "maximum_attempts": 3,
  "created_at": "2026-08-23T19:10:13.082236Z",
  "updated_at": "2026-08-23T19:16:10.162089Z",
  "output_refs": [
    "proposals/sources/RUN-OFS003-PILOT-004/WORK-000003.json"
  ],
  "output_digests": {
    "proposals/sources/RUN-OFS003-PILOT-004/WORK-000003.json": "dcbf755bb1d61a36b7c221053292c3812d9125130bfe79f4c90987532638c8a6"
  },
  "usage": {
    "input_tokens": null,
    "output_tokens": null,
    "cost_usd": null,
    "measurement_note": "Interactive Codex Web research; per-Work-Item usage unavailable."
  },
  "completed_by_agent_id": "discovery-public-01",
  "completion_mode": "leased-local",
  "completed_at": "2026-08-23T19:16:10.162089Z"
}
