{
  "schema_version": "0.1.0",
  "work_item_id": "WORK-000030",
  "run_id": "RUN-OFS001-PILOT-003",
  "task_id": "OFS-001",
  "monitor_id": "MON-MEMORY-001",
  "kind": "synthesis",
  "required_role": "synthesis",
  "status": "completed",
  "idempotency_key": "76a7fc244fad3b0e638922dcc7b3153dbb49a9824621212a531dec621b2ea45e",
  "payload": {
    "query": "HBM4 power efficiency independent measurement limitations",
    "query_role": "falsification",
    "evidence_bundle_refs": [
      "proposals/evidence/RUN-OFS001-PILOT-003/WORK-000024.json",
      "proposals/evidence/RUN-OFS001-PILOT-003/WORK-000026.json"
    ],
    "parent_work_item_ids": [
      "WORK-000024",
      "WORK-000026"
    ]
  },
  "output_paths": [
    "proposals/claims/RUN-OFS001-PILOT-003/WORK-000030.json"
  ],
  "attempt": 1,
  "maximum_attempts": 3,
  "created_at": "2026-08-23T17:43:53.756803Z",
  "updated_at": "2026-08-23T17:45:42.797674Z",
  "output_refs": [
    "proposals/claims/RUN-OFS001-PILOT-003/WORK-000030.json"
  ],
  "output_digests": {
    "proposals/claims/RUN-OFS001-PILOT-003/WORK-000030.json": "621af30517a2b2f2bcb3b1e86fd660ad6d0444aebc1b073d52e93f3615f32dbb"
  },
  "completed_by_agent_id": "synthesis-public-01",
  "completed_at": "2026-08-23T17:45:42.797674Z"
}
